### ISSUE TITLE
Change "MQTT/IBM Cloud Config" to use IBM Watson IOT Platform but it doesn't work.

### ISSUE THREAD

**Issue by chenek** [contiki-os/contiki#2378]
I try to change "MQTT/IBM Cloud Config" to use IBM Watson IOT Platform by the following steps:
1. I am not sure the exact device ID format with device MAC "00:12:4b:00:0e:00:cc:00" so I create two devices like the followings. As you can see, one is directly mapped to device MAC and another is grabbed from IBM quickstart format.
![device](https://user-images.githubusercontent.com/14016565/32492393-142460f6-c3f5-11e7-983a-ea326d61accb.jpg)

2. Input the following information into "MQTT/IBM Cloud Config" page. Type ID is input by me when I generate device on  IBM Watson IOT Platform. Org ID and Auth token are generated by IBM Watson IOT Platform when I add the device.
![mqtt](https://user-images.githubusercontent.com/14016565/32492497-6e5ac2ea-c3f5-11e7-8892-57ec22113f68.jpg)

3. Submit and reconnect to MQTT. I receive nothing on IBM Watson IOT Platform. I keep seeing device disconnect on device page of  IBM Watson IOT Platform.
![devicedisconnect](https://user-images.githubusercontent.com/14016565/32492709-362c264c-c3f6-11e7-9e92-dc90d031f755.jpg)

4. I use tcpdump to dump network traffic on port 1883 of 6lbr running on Raspberry Pi and get the following results.:

pi@raspberrypi ~ $ sudo tcpdump -X -v -i eth0 port 1883
tcpdump: WARNING: eth0: no IPv4 address assigned
tcpdump: listening on eth0, link-type EN10MB (Ethernet), capture size 65535 bytes
11:39:59.784238 IP (tos 0x0, ttl 63, id 8489, offset 0, flags [none], proto TCP (6), length 44)
    10.15.8.79.17777 > msproxy-quickstart-0.dal06.internetofthings.ibmcloud.com.1883: Flags [S], cksum 0xfd12 (correct), seq 2868, win 128, options [mss 128], length 0
        0x0000:  4500 002c 2129 0000 3f06 12dc 0a0f 084f  E..,!)..?......O
        0x0010:  b8ac 7cbd 4571 075b 0000 0b34 0000 0000  ..|.Eq.[...4....
        0x0020:  6002 0080 fd12 0000 0204 0080            `...........
11:39:59.985813 IP (tos 0x0, ttl 49, id 0, offset 0, flags [DF], proto TCP (6), length 44)
    msproxy-quickstart-0.dal06.internetofthings.ibmcloud.com.1883 > 10.15.8.79.17777: Flags [S.], cksum 0x8945 (correct), seq 918100354, ack 2869, win 8010, options [mss 1335], length 0
        0x0000:  4500 002c 0000 4000 3106 0205 b8ac 7cbd  E..,..@.1.....|.
        0x0010:  0a0f 084f 075b 4571 36b9 1982 0000 0b35  ...O.[Eq6......5
        0x0020:  6012 1f4a 8945 0000 0204 0537 0000       `..J.E.....7..
11:40:00.067690 IP (tos 0x0, ttl 63, id 8490, offset 0, flags [none], proto TCP (6), length 40)
    10.15.8.79.17777 > msproxy-quickstart-0.dal06.internetofthings.ibmcloud.com.1883: Flags [.], cksum 0xbf4f (correct), ack 1, win 128, length 0
        0x0000:  4500 0028 212a 0000 3f06 12df 0a0f 084f  E..(!*..?......O
        0x0010:  b8ac 7cbd 4571 075b 0000 0b35 36b9 1983  ..|.Eq.[...56...
        0x0020:  5010 0080 bf4f 0000                      P....O..
11:40:00.092779 IP (tos 0x0, ttl 63, id 8491, offset 0, flags [none], proto TCP (6), length 72)
    10.15.8.79.17777 > msproxy-quickstart-0.dal06.internetofthings.ibmcloud.com.1883: Flags [P.], cksum 0xae3c (correct), seq 1:33, ack 1, win 128, length 32
        0x0000:  4500 0048 212b 0000 3f06 12be 0a0f 084f  E..H!+..?......O
        0x0010:  b8ac 7cbd 4571 075b 0000 0b35 36b9 1983  ..|.Eq.[...56...
        0x0020:  5018 0080 ae3c 0000 104e 0006 4d51 4973  P....<...N..MQIs
        0x0030:  6470 03c2 0f00 001c 643a 6633 6a63 746b  dp......d:f3jctk
        0x0040:  3a63 6331 3378 783a                      :cc13xx:
11:40:00.294645 IP (tos 0x0, ttl 49, id 48380, offset 0, flags [DF], proto TCP (6), length 40)
    msproxy-quickstart-0.dal06.internetofthings.ibmcloud.com.1883 > 10.15.8.79.17777: Flags [.], cksum 0xa065 (correct), ack 33, win 8010, length 0
        0x0000:  4500 0028 bcfc 4000 3106 450c b8ac 7cbd  E..(..@.1.E...|.
        0x0010:  0a0f 084f 075b 4571 36b9 1983 0000 0b55  ...O.[Eq6......U
        0x0020:  5010 1f4a a065 0000 0000 0000 0000       P..J.e........
11:40:00.383303 IP (tos 0x0, ttl 63, id 8492, offset 0, flags [none], proto TCP (6), length 72)
    10.15.8.79.17777 > msproxy-quickstart-0.dal06.internetofthings.ibmcloud.com.1883: Flags [P.], cksum 0x178f (correct), seq 33:65, ack 1, win 128, length 32
        0x0000:  4500 0048 212c 0000 3f06 12bd 0a0f 084f  E..H!,..?......O
        0x0010:  b8ac 7cbd 4571 075b 0000 0b55 36b9 1983  ..|.Eq.[...U6...
        0x0020:  5018 0080 178f 0000 3030 3132 3462 3030  P.......00124b00
        0x0030:  6363 3030 000e 7573 652d 746f 6b65 6e2d  cc00..use-token-
        0x0040:  6175 7468 0012 4f4f                      auth..OO
11:40:00.584485 IP (tos 0x0, ttl 49, id 48381, offset 0, flags [DF], proto TCP (6), length 40)
    msproxy-quickstart-0.dal06.internetofthings.ibmcloud.com.1883 > 10.15.8.79.17777: Flags [.], cksum 0xa045 (correct), ack 65, win 8010, length 0
        0x0000:  4500 0028 bcfd 4000 3106 450b b8ac 7cbd  E..(..@.1.E...|.
        0x0010:  0a0f 084f 075b 4571 36b9 1983 0000 0b75  ...O.[Eq6......u
        0x0020:  5010 1f4a a045 0000 0000 0000 0000       P..J.E........
11:40:00.669380 IP (tos 0x0, ttl 63, id 8493, offset 0, flags [none], proto TCP (6), length 56)
    10.15.8.79.17777 > msproxy-quickstart-0.dal06.internetofthings.ibmcloud.com.1883: Flags [P.], cksum 0xe156 (correct), seq 65:81, ack 1, win 128, length 16
        0x0000:  4500 0038 212d 0000 3f06 12cc 0a0f 084f  E..8!-..?......O
        0x0010:  b8ac 7cbd 4571 075b 0000 0b75 36b9 1983  ..|.Eq.[...u6...
        0x0020:  5018 0080 e156 0000 4f71 4553 4a62 7967  P....V..OqESJbyg
        0x0030:  5838 704a 4a69 7226                      X8pJJir&
11:40:00.872046 IP (tos 0x0, ttl 49, id 48382, offset 0, flags [DF], proto TCP (6), length 40)
    msproxy-quickstart-0.dal06.internetofthings.ibmcloud.com.1883 > 10.15.8.79.17777: Flags [.], cksum 0xa035 (correct), ack 81, win 8010, length 0
        0x0000:  4500 0028 bcfe 4000 3106 450a b8ac 7cbd  E..(..@.1.E...|.
        0x0010:  0a0f 084f 075b 4571 36b9 1983 0000 0b85  ...O.[Eq6.......
        0x0020:  5010 1f4a a035 0000 0000 0000 0000       P..J.5........
11:40:00.872244 IP (tos 0x0, ttl 49, id 48383, offset 0, flags [DF], proto TCP (6), length 44)
    msproxy-quickstart-0.dal06.internetofthings.ibmcloud.com.1883 > 10.15.8.79.17777: Flags [P.], cksum 0x8022 (correct), seq 1:5, ack 81, win 8010, length 4
        0x0000:  4500 002c bcff 4000 3106 4505 b8ac 7cbd  E..,..@.1.E...|.
        0x0010:  0a0f 084f 075b 4571 36b9 1983 0000 0b85  ...O.[Eq6.......
        0x0020:  5018 1f4a 8022 0000 2002 0005 0000       P..J."........
11:40:00.872390 IP (tos 0x0, ttl 49, id 48384, offset 0, flags [DF], proto TCP (6), length 40)
    msproxy-quickstart-0.dal06.internetofthings.ibmcloud.com.1883 > 10.15.8.79.17777: Flags [F.], cksum 0xa030 (correct), seq 5, ack 81, win 8010, length 0
        0x0000:  4500 0028 bd00 4000 3106 4508 b8ac 7cbd  E..(..@.1.E...|.
        0x0010:  0a0f 084f 075b 4571 36b9 1987 0000 0b85  ...O.[Eq6.......
        0x0020:  5011 1f4a a030 0000 0000 0000 0000       P..J.0........
11:40:01.014070 IP (tos 0x0, ttl 63, id 8494, offset 0, flags [none], proto TCP (6), length 40)
    10.15.8.79.17777 > msproxy-quickstart-0.dal06.internetofthings.ibmcloud.com.1883: Flags [.], cksum 0xbefb (correct), ack 5, win 128, length 0
        0x0000:  4500 0028 212e 0000 3f06 12db 0a0f 084f  E..(!...?......O
        0x0010:  b8ac 7cbd 4571 075b 0000 0b85 36b9 1987  ..|.Eq.[....6...
        0x0020:  5010 0080 befb 0000                      P.......
11:40:01.031442 IP (tos 0x0, ttl 63, id 8495, offset 0, flags [none], proto TCP (6), length 40)
    10.15.8.79.17777 > msproxy-quickstart-0.dal06.internetofthings.ibmcloud.com.1883: Flags [R.], cksum 0xbef7 (correct), seq 81, ack 5, win 128, length 0
        0x0000:  4500 0028 212f 0000 3f06 12da 0a0f 084f  E..(!/..?......O
        0x0010:  b8ac 7cbd 4571 075b 0000 0b85 36b9 1987  ..|.Eq.[....6...
        0x0020:  5014 0080 bef7 0000                      P.......
11:40:01.100848 IP (tos 0x0, ttl 63, id 8496, offset 0, flags [none], proto TCP (6), length 40)
    10.15.8.79.17777 > msproxy-quickstart-0.dal06.internetofthings.ibmcloud.com.1883: Flags [R.], cksum 0xa02c (correct), seq 81, ack 6, win 8010, length 0
        0x0000:  4500 0028 2130 0000 3f06 12d9 0a0f 084f  E..(!0..?......O
        0x0010:  b8ac 7cbd 4571 075b 0000 0b85 36b9 1988  ..|.Eq.[....6...
        0x0020:  5014 1f4a a02c 0000                      P..J.,..

Why does device page show disconnect? Is there any guide for this or had anyone do this successfully?
